{
  "version": 2,
  "updatedAt": "2026-01-29T00:00:00Z",
  "thresholds": {
    "loop": {
      "repeatedStateRatio": 0.25,
      "minRepeatedStates": 1
    },
    "forcedMove": {
      "ratio": 0.8
    },
    "dominantAction": {
      "ratio": 0.8,
      "minSamples": 10
    },
    "trivialWin": {
      "winRate": 0.9,
      "maxAvgSteps": 3,
      "minSamples": 3
    },
    "highSkippedEffects": {
      "rate": 0.10,
      "minAttempts": 50
    }
  },
  "enabledFlags": [
    "loop",
    "stalemate",
    "forced-move",
    "dominant-action",
    "trivial-win",
    "no-choices",
    "non-terminating",
    "high-skipped-effects"
  ],
  "policyByFlag": {
    "loop": "reject",
    "non-terminating": "reject",
    "forced-move": "penalize",
    "no-choices": "reject",
    "dominant-action": "penalize",
    "trivial-win": "penalize",
    "stalemate": "penalize",
    "high-skipped-effects": "penalize"
  },
  "penalties": {
    "forced-move": { "weight": 0.3, "freeRatio": 0.2 },
    "no-choices": { "weight": 0.5 },
    "dominant-action": { "weight": 0.2 },
    "trivial-win": { "weight": 0.3 },
    "stalemate": { "weight": 0.1 },
    "high-skipped-effects": { "weight": 0.2 }
  },
  "minStepsForNoChoices": 10,
  "compoundRejection": {
    "enabled": true,
    "maxPenaltyFlags": 3
  }
}
